{
  "$schema": "https://company.example/schemas/knowledge-pack.schema.json",
  "meta": {
    "library_name": "shadcn-ui",
    "library_version": "v4 (canary, Tailwind v4 / React 19)",
    "source_commit": "main",
    "generated_at": "2026-06-17T00:00:00Z",
    "extractor_version": "0.1.0",
    "coverage_confidence": 0.85
  },
  "tech_stack": {
    "framework": {
      "name": "react",
      "version": ">=18"
    },
    "language": "ts",
    "bundler": "vite",
    "package_manager": "pnpm",
    "node_version": ">=18.0.0",
    "styling_system": "tailwind",
    "peer_dependencies": [
      "react@>=18",
      "react-dom@>=18",
      "tailwindcss@^4",
      "radix-ui@^1.4",
      "class-variance-authority@^0.7",
      "clsx@^2",
      "tailwind-merge@^2",
      "lucide-react@^0.400",
      "next-themes@^0.4"
    ],
    "build_commands": {
      "dev": "pnpm dev",
      "build": "pnpm build",
      "test": "pnpm test"
    },
    "supported_targets": [
      "web",
      "ssr",
      "next.js",
      "vite",
      "remix",
      "astro"
    ]
  },
  "design_tokens": {
    "source": {
      "file": "apps/v4/app/globals.css",
      "format": "css-custom-properties"
    },
    "color": {
      "light": {
        "--background": "oklch(1 0 0)",
        "--foreground": "oklch(0% 0 0)",
        "--card": "oklch(1 0 0)",
        "--card-foreground": "oklch(0% 0 0)",
        "--popover": "oklch(1 0 0)",
        "--popover-foreground": "oklch(0% 0 0)",
        "--primary": "oklch(0% 0 0)",
        "--primary-foreground": "oklch(0.985 0 0)",
        "--secondary": "oklch(0.97 0 0)",
        "--secondary-foreground": "oklch(0.205 0 0)",
        "--muted": "oklch(0.97 0 0)",
        "--muted-foreground": "oklch(0.556 0 0)",
        "--accent": "oklch(0.97 0 0)",
        "--accent-foreground": "oklch(0.205 0 0)",
        "--destructive": "oklch(0.577 0.245 27.325)",
        "--destructive-foreground": "oklch(0.97 0.01 17)",
        "--border": "oklch(0.922 0 0)",
        "--input": "oklch(0.922 0 0)",
        "--ring": "oklch(0.708 0 0)",
        "--sidebar": "oklch(0.985 0 0)",
        "--sidebar-foreground": "oklch(0% 0 0)",
        "--sidebar-primary": "oklch(0.205 0 0)",
        "--sidebar-primary-foreground": "oklch(0.985 0 0)",
        "--sidebar-accent": "oklch(0.97 0 0)",
        "--sidebar-accent-foreground": "oklch(0.205 0 0)",
        "--sidebar-border": "oklch(0.922 0 0)",
        "--sidebar-ring": "oklch(0.708 0 0)"
      },
      "dark": {
        "--background": "oklch(0.145 0 0)",
        "--foreground": "oklch(0.985 0 0)",
        "--card": "oklch(0.205 0 0)",
        "--card-foreground": "oklch(0.985 0 0)",
        "--popover": "oklch(0.205 0 0)",
        "--popover-foreground": "oklch(0.985 0 0)",
        "--primary": "oklch(0.922 0 0)",
        "--primary-foreground": "oklch(0.205 0 0)",
        "--secondary": "oklch(0.269 0 0)",
        "--secondary-foreground": "oklch(0.985 0 0)",
        "--muted": "oklch(0.269 0 0)",
        "--muted-foreground": "oklch(0.708 0 0)",
        "--accent": "oklch(0.371 0 0)",
        "--accent-foreground": "oklch(0.985 0 0)",
        "--destructive": "oklch(0.704 0.191 22.216)",
        "--destructive-foreground": "oklch(0.58 0.22 27)",
        "--border": "oklch(1 0 0 / 10%)",
        "--input": "oklch(1 0 0 / 15%)",
        "--ring": "oklch(0.556 0 0)",
        "--sidebar": "oklch(0.205 0 0)",
        "--sidebar-foreground": "oklch(0.985 0 0)",
        "--sidebar-primary": "oklch(0.488 0.243 264.376)",
        "--sidebar-primary-foreground": "oklch(0.985 0 0)",
        "--sidebar-accent": "oklch(0.269 0 0)",
        "--sidebar-accent-foreground": "oklch(0.985 0 0)",
        "--sidebar-border": "oklch(1 0 0 / 10%)",
        "--sidebar-ring": "oklch(0.439 0 0)"
      }
    },
    "radius": {
      "--radius": "0.625rem"
    }
  },
  "design_principles": {
    "principles": [
      "Copy-paste ownership: components are copied into your project via CLI, not imported from npm — you own the source",
      "Radix UI primitives provide accessible behavior; shadcn adds Tailwind styling on top",
      "Tailwind CSS v4 + CSS custom properties (oklch) for all design tokens",
      "class-variance-authority (CVA) for type-safe variant props",
      "cn() utility (clsx + tailwind-merge) for conditional className composition",
      "data-slot attributes on every component enable precise CSS targeting without hacks",
      "Dark mode via next-themes ThemeProvider with attribute='class' — toggled by adding 'dark' class to <html>"
    ],
    "voice_tone": "developer-focused and minimal",
    "density": "comfortable",
    "layout_grids": [
      "Tailwind CSS grid and flex utilities — no grid system built-in",
      "Sidebar component for app shell layouts"
    ],
    "brand_constraints": "Design tokens defined as CSS custom properties in globals.css; swap themes by changing token values",
    "do": [
      "Run `npx shadcn@latest add <component>` to copy component into components/ui/",
      "Import components from '@/components/ui/<name>' (path alias required in tsconfig)",
      "Use cn() from '@/lib/utils' for conditional className merging",
      "Wrap app with ThemeProvider from next-themes for dark mode support",
      "Use the Form component (react-hook-form wrapper) for accessible form validation"
    ],
    "dont": [
      "Don't import from an npm package — shadcn components are local files in your project",
      "Don't modify Radix primitives directly — wrap or extend via className and data-slot targeting",
      "Don't skip the cn() utility — raw className concatenation breaks Tailwind deduplication",
      "Don't forget to configure path alias '@' in tsconfig.json pointing to './src' or '.'"
    ]
  },
  "components": [
    {
      "name": "Button",
      "aliases": ["btn", "cta", "action-button", "icon-button"],
      "category": "form",
      "status": "stable",
      "import": {
        "package": "@/components/ui",
        "export": "Button",
        "path": "@/components/ui/button"
      },
      "anatomy": {
        "parts": ["Button"]
      },
      "props": [
        {
          "name": "variant",
          "type": "string",
          "required": false,
          "default": "default",
          "enum": ["default", "destructive", "outline", "secondary", "ghost", "link"],
          "description": "Visual style variant"
        },
        {
          "name": "size",
          "type": "string",
          "required": false,
          "default": "default",
          "enum": ["default", "xs", "sm", "lg", "icon", "icon-xs", "icon-sm", "icon-lg"],
          "description": "Button size controlling height, padding, and font size"
        },
        {
          "name": "asChild",
          "type": "boolean",
          "required": false,
          "default": false,
          "description": "Render as child element via Radix Slot (polymorphic)"
        },
        {
          "name": "disabled",
          "type": "boolean",
          "required": false,
          "default": false,
          "description": "Disables button interaction"
        },
        {
          "name": "className",
          "type": "string",
          "required": false,
          "description": "Additional Tailwind classes merged via cn()"
        }
      ],
      "variants": ["default", "destructive", "outline", "secondary", "ghost", "link"],
      "states": ["default", "hover", "focus", "active", "disabled"],
      "behaviors": [
        { "trigger": "click", "result": "Fires onClick handler; no-op when disabled" },
        { "trigger": "asChild=true", "result": "Renders as immediate child element via Radix Slot.Root" }
      ],
      "keyboard_map": [
        { "key": "Enter", "action": "Activates the button" },
        { "key": "Space", "action": "Activates the button" },
        { "key": "Tab", "action": "Moves focus to next focusable element" }
      ],
      "accessibility": {
        "role": "button",
        "aria": ["aria-disabled (when disabled)"],
        "focus_management": "Receives focus via Tab; focus-visible ring rendered with ring-ring color",
        "wcag_notes": "SC 4.1.2 requires accessible name; use aria-label for icon-only buttons"
      },
      "composition": {
        "composed_of": ["Radix Slot"],
        "commonly_used_with": ["Dialog", "Sheet", "Card", "Form", "DropdownMenu"]
      },
      "examples": [
        {
          "title": "Default Button",
          "code": "import { Button } from '@/components/ui/button'\n\n<Button>Click me</Button>"
        },
        {
          "title": "Variants",
          "code": "import { Button } from '@/components/ui/button'\n\n<Button variant=\"outline\">Outline</Button>\n<Button variant=\"destructive\">Delete</Button>\n<Button variant=\"ghost\">Ghost</Button>"
        }
      ],
      "source_refs": [
        "https://raw.githubusercontent.com/shadcn-ui/ui/main/apps/v4/registry/new-york-v4/ui/button.tsx"
      ]
    },
    {
      "name": "Input",
      "aliases": ["text-input", "text-field"],
      "category": "form",
      "status": "stable",
      "import": {
        "package": "@/components/ui",
        "export": "Input",
        "path": "@/components/ui/input"
      },
      "anatomy": {
        "parts": ["Input"]
      },
      "props": [
        {
          "name": "type",
          "type": "string",
          "required": false,
          "default": "text",
          "description": "HTML input type attribute"
        },
        {
          "name": "disabled",
          "type": "boolean",
          "required": false,
          "default": false,
          "description": "Disables the input"
        },
        {
          "name": "placeholder",
          "type": "string",
          "required": false,
          "description": "Placeholder text"
        },
        {
          "name": "className",
          "type": "string",
          "required": false,
          "description": "Additional Tailwind classes"
        }
      ],